UID,State,Title,Subtitle,Brief,Text,Response 1,Response 1 Blurb,Response 2,Response 2 Blurb,
BI00065,FL,Number 5,A Constitutional ammendment relating to the judiciary.,"Proposing a revision of Article V of the State Constitution relating to the judiciary. The State Constitution authorizes the Supreme Court to adopt rules for the practice and procedure in all courts. The constitution further provides that a rule of court may be repealed by a general law enacted by a two-thirds vote of the membership of each house of the Legislature. This proposed constitutional revision eliminates the requirement that a general law repealing a court rule pass by a two-thirds vote of each house, thereby providing that the Legislature may repeal a rule of court by a general law approved by a majority vote of each house of the Legislature that expresses the policy behind the repeal. The court could readopt the rule in conformity with the public policy expressed by the Legislature, but if the Legislature determines that a rule has been readopted and repeals the readopted rule, this proposed revision prohibits the court from further readopting the repealed rule without the Legislature's prior approval. Under current law, rules of the judicial nominating commissions and the Judicial Qualifications Commission may be repealed by general law enacted by a majority vote of the membership of each house of the Legislature. Under this proposed revision, a vote to repeal those rules is changed to repeal by general law enacted by a majority vote of the legislators present. Under current law, the Governor appoints a justice of the Supreme Court from a list of nominees provided by a judicial nominating commission, and appointments by the Governor are not subject to confirmation. This revision requires Senate confirmation of a justice of the Supreme Court before the appointee can take office. If the Senate votes not to confirm the appointment, the judicial nominating commission must reconvene and may not renominate any person whose prior appointment to fill the same vacancy was not confirmed by the Senate. For the purpose of confirmation, the Senate may meet at any time. If the Senate fails to vote on the appointment of a justice within 90 days, the justice will be deemed confirmed and will take office. The Judicial Qualifications Commission is an independent commission created by the State Constitution to investigate and prosecute before the Florida Supreme Court alleged misconduct by a justice or judge. Currently under the constitution, commission proceedings are confidential until formal charges are filed by the investigative panel of the commission. Once formal charges are filed, the formal charges and all further proceedings of the commission are public. Currently, the constitution authorizes the House of Representatives to impeach a justice or judge. Further, the Speaker of the House of Representatives may request, and the Judicial Qualifications Commission must make available, all information in the commission's possession for use in deciding whether to impeach a justice or judge. This proposed revision requires the commission to make all of its files available to the Speaker of the House of Representatives but provides that such files would remain confidential during any investigation by the House of Representatives and until such information is used in the pursuit of an impeachment of a justice or judge. This revision also removes the power of the Governor to request files of the Judicial Qualifications Commission to conform to a prior constitutional change. This revision also makes technical and clarifying additions and deletions relating to the selection of chief judges of a circuit and relating to the Judicial Qualifications Commission, and makes other nonsubstantive conforming and technical changes in the judicial article of the constitution.",http://election.dos.state.fl.us/initiatives/fulltext/pdf/10-81.pdf,Yes,"Approves an ammendment to Article V, relating to the judiciary. The State Constitution authorizes the Supreme Court to adopt rules for the practice and procedure in all courts. The constitution further provides that a rule of court may be repealed by a general law enacted by a two-thirds vote of the membership of each house of the Legislature. This proposed constitutional revision eliminates the requirement that a general law repealing a court rule pass by a two-thirds vote of each house, thereby providing that the Legislature may repeal a rule of court by a general law approved by a majority vote of each house of the Legislature that expresses the policy behind the repeal. The court could readopt the rule in conformity with the public policy expressed by the Legislature, but if the Legislature determines that a rule has been readopted and repeals the readopted rule, this proposed revision prohibits the court from further readopting the repealed rule without the Legislature's prior approval. Under current law, rules of the judicial nominating commissions and the Judicial Qualifications Commission may be repealed by general law enacted by a majority vote of the membership of each house of the Legislature. Under this proposed revision, a vote to repeal those rules is changed to repeal by general law enacted by a majority vote of the legislators present. Under current law, the Governor appoints a justice of the Supreme Court from a list of nominees provided by a judicial nominating commission, and appointments by the Governor are not subject to confirmation. This revision requires Senate confirmation of a justice of the Supreme Court before the appointee can take office. If the Senate votes not to confirm the appointment, the judicial nominating commission must reconvene and may not renominate any person whose prior appointment to fill the same vacancy was not confirmed by the Senate. For the purpose of confirmation, the Senate may meet at any time. If the Senate fails to vote on the appointment of a justice within 90 days, the justice will be deemed confirmed and will take office. The Judicial Qualifications Commission is an independent commission created by the State Constitution to investigate and prosecute before the Florida Supreme Court alleged misconduct by a justice or judge. Currently under the constitution, commission proceedings are confidential until formal charges are filed by the investigative panel of the commission. Once formal charges are filed, the formal charges and all further proceedings of the commission are public. Currently, the constitution authorizes the House of Representatives to impeach a justice or judge. Further, the Speaker of the House of Representatives may request, and the Judicial Qualifications Commission must make available, all information in the commission's possession for use in deciding whether to impeach a justice or judge. This proposed revision requires the commission to make all of its files available to the Speaker of the House of Representatives but provides that such files would remain confidential during any investigation by the House of Representatives and until such information is used in the pursuit of an impeachment of a justice or judge. This revision also removes the power of the Governor to request files of the Judicial Qualifications Commission to conform to a prior constitutional change. This revision also makes technical and clarifying additions and deletions relating to the selection of chief judges of a circuit and relating to the Judicial Qualifications Commission, and makes other nonsubstantive conforming and technical changes in the judicial article of the constitution.",No,Rejects the proposed amendment and maintains current law.,""
BI00066,FL,Number 6,A Constitutional amendment provides that public funds may not be expended for any abortion or for health-benefits coverage that includes coverage of abortion.,"This proposed amendment provides that public funds may not be expended for any abortion or for health-benefits coverage that includes coverage of abortion. This prohibition does not apply to an expenditure required by federal law, a case in which a woman suffers from a physical disorder, physical injury, or physical illness that would place her in danger of death unless an abortion is performed, or a case of rape or incest. This proposed amendment provides that the State Constitution may not be interpreted to create broader rights to an abortion than those contained in the United States Constitution. With respect to abortion, this proposed amendment overrules court decisions which conclude that the right of privacy under Article I, Section 23 of the State Constitution is broader in scope than that of the United States Constitution. ",http://election.dos.state.fl.us/initiatives/fulltext/pdf/10-82.pdf,Yes,"Approves an amendment providing that public funds may not be expended for any abortion or for health-benefits coverage that includes coverage of abortion. This prohibition does not apply to an expenditure required by federal law, a case in which a woman suffers from a physical disorder, physical injury, or physical illness that would place her in danger of death unless an abortion is performed, or a case of rape or incest. This amendment provides that the State Constitution may not be interpreted to create broader rights to an abortion than those contained in the United States Constitution. With respect to abortion, this proposed amendment overrules court decisions which conclude that the right of privacy under Article I, Section 23 of the State Constitution is broader in scope than that of the United States Constitution. ",No,Rejects the proposed amendment and maintains current law.,""
BI00067,FL,Number 8,"A Constitutional ammendment providing that no individual or entity may be denied, on the basis of religious identity or belief, governmental benefits, funding or other support.","Proposing an amendment to the State Constitution providing that no individual or entity may be denied, on the basis of religious identity or belief, governmental benefits, funding or other support, except as required by the First Amendment to the United States Constitution, and deleting the prohibition against using revenues from the public treasury directly or indirectly in aid of any church, sect, or religious denomination or in aid of any sectarian institution.",http://election.dos.state.fl.us/initiatives/fulltext/pdf/10-86.pdf,Yes,"Approves an ammendment providing that no individual or entity may be denied, on the basis of religious identity or belief, governmental benefits, funding or other support, except as required by the First Amendment to the United States Constitution, and deleting the prohibition against using revenues from the public treasury directly or indirectly in aid of any church, sect, or religious denomination or in aid of any sectarian institution.",No,Rejects the proposed amendment and maintains current law.,""
BI00068,FL,Number 9,A Constitutional Ammendment pertaining to Homestead Property Tax Exemption for surviving spouses of Military Veteran or First Responder,"Proposing an amendment to the State Constitution to authorize the Legislature to provide by general law ad valorem homestead property tax relief to the surviving spouse of a military veteran who died from service- connected causes while on active duty or to the surviving spouse of a first responder who died in the line of duty. The amendment authorizes the Legislature to totally exempt or partially exempt such surviving spouse's homestead property from ad valorem taxation. The amendment defines a first responder as a law enforcement officer, a correctional officer, a firefighter, an emergency medical technician, or a paramedic. This amendment shall take effect January 1, 2013.",http://election.dos.state.fl.us/initiatives/fulltext/pdf/10-87.pdf,Yes,"Approves an ammendment to authorize the Legislature to provide by general law ad valorem homestead property tax relief to the surviving spouse of a military veteran who died from service- connected causes while on active duty or to the surviving spouse of a first responder who died in the line of duty. The amendment authorizes the Legislature to totally exempt or partially exempt such surviving spouse's homestead property from ad valorem taxation. The amendment defines a first responder as a law enforcement officer, a correctional officer, a firefighter, an emergency medical technician, or a paramedic. This amendment shall take effect January 1, 2013.",No,Rejects the proposed amendment and maintains current law.,""
BI00069,FL,Number 10,A Constitutional ammendment pertaining to the tangible personal property tax exemptions,"Proposing an amendment to the State Constitution to: (1) Provide an exemption from ad valorem taxes levied by counties, municipalities, school districts, and other local governments on tangible personal property if the assessed value of an owner's tangible personal property is greater than $25,000 but less than $50,000. This new exemption, if approved by the voters, will take effect on January 1, 2013, and apply to the 2013 tax roll and subsequent tax rolls. (2) Authorize a county or municipality for the purpose of its respective levy, and as provided by general law, to provide tangible personal property tax exemptions by ordinance. This is in addition to other statewide tangible personal property tax exemptions provided by the Constitution and this amendment.ae",http://election.dos.state.fl.us/initiatives/fulltext/pdf/10-88.pdf,Yes,"Approves an ammendment providing for an exemption from ad valorem taxes levied by counties, municipalities, school districts, and other local governments on tangible personal property if the assessed value of an owner's tangible personal property is greater than $25,000 but less than $50,000. This new exemption, if approved by the voters, will take effect on January 1, 2013, and apply to the 2013 tax roll and subsequent tax rolls. Also authorize a county or municipality for the purpose of its respective levy, and as provided by general law, to provide tangible personal property tax exemptions by ordinance. This is in addition to other statewide tangible personal property tax exemptions provided by the Constitution and this amendment.",No,Rejects the proposed amendment and maintains current law.,""
BI00070,FL,Number 11,A Constitutional ammendment to provide additional homestead exemptions for low-income seniors who maintain long-term residency on property equal to assessed value,"Proposing an amendment to the State Constitution to authorize the Legislature, by general law and subject to conditions set forth in the general law, to",http://election.dos.state.fl.us/initiatives/fulltext/pdf/10-89.pdf,Yes,"Approves an ammendment to allow counties and municipalities to grant an additional homestead tax exemption equal to the assessed value of homestead property if the property has a just value less than $250,000 to an owner who has maintained permanent residency on the property for not less than 25 years, who has attained age 65, and who has a low household income as defined by general law.",No,Rejects the proposed amendment and maintains current law.,""
BI00071,FL,Number 12,A Constitutional ammendment providing for the appointment of Student Body President to Board of Governors of the State University System,Proposing an amendment to the State Constitution to replace the president of the Florida Student Association with the chair of the council of state university student body presidents as the student member of the Board of Governors of the State University System and to require that the Board of Governors organize such council of state university student body presidents.,http://election.dos.state.fl.us/initiatives/fulltext/pdf/10-90.pdf,Yes,Approves an ammendment replacing the president of the Florida Student Association with the chair of the council of state university student body presidents as the student member of the Board of Governors of the State University System and to require that the Board of Governors organize such council of state university student body presidents.,No,Rejects the proposed amendment and maintains current law.,""
BI00072,GA,HR 1162,A Constitutional ammendment to allow state or local approval of public charter schools upon the request of local communities,Proposing an amendment to the Constitution of Georgia so as to clarify the authority of the  state to establish state-wide education policy; to restate the authority of the General Assembly to establish special schools; to provide that special schools include state charter schools; to provide for related matters; to provide for the submission of this amendment for ratification or rejection; and for other purposes.,http://www.legis.ga.gov/Legislation/20112012/125399.pdf,Yes,"Approves an ammendment which clarifies the authority of the  state to establish state-wide education policy, restates the authority of the General Assembly to establish special schools, provides that special schools include state charter schools; provides for related matters, and provides for the submission of this amendment for ratification or rejection.",No,Rejects the proposed amendment and maintains current law.,""
BI00073,KY,HB 1,"An Act proposing to amend the Constitution of Kentucky relating to hunting, fishing, and harvesting wildlife.","IT IS PROPOSED THAT A NEW SECTION BE ADDED TO THE CONSTITUTION OF KENTUCKY TO READ AS FOLLOWS:The citizens of Kentucky have the personal right to hunt, fish, and harvest wildlife, using traditional methods, subject only to statutes enacted by the Legislature, and to administrative regulations adopted by the designated state agency to promote wildlife conservation and management and to preserve the future of hunting and fishing. Public hunting and fishing shall be a preferred means of managing and controlling wildlife. This section shall not be construed to modify any provision of law relating to trespass, property rights, or the regulation of commercial activities.",http://www.lrc.ky.gov/record/11RS/HB1.htm,Yes,"Approves the following addition to the constitution: The citizens of Kentucky have the personal right to hunt, fish, and harvest wildlife, using traditional methods, subject only to statutes enacted by the Legislature, and to administrative regulations adopted by the designated state agency to promote wildlife conservation and management and to preserve the future of hunting and fishing. Public hunting and fishing shall be a preferred means of managing and controlling wildlife. This section shall not be construed to modify any provision of law relating to trespass, property rights, or the regulation of commercial activities.",No,Rejects the proposed addition and maintains current law.,""
BI00074,LA,Amendment No. 1 ,An amendment to prohibit the Medicaid Trust Fund for the Elderly from being used or appropriated for other purposes when adjustments are made to eliminate a state deficit.,"Act 873 (2012 Regular Session) adds Article VII, Section 10(F)(4)(g).Present Constitution authorizes the legislature to establish a procedure to determine if there will be a projected deficit and an adequate method for adjusting appropriations to eliminate the projected deficit. Present Constitution exempts the following from such adjustments: (a)  The Bond Security and Redemption Fund or any bonds secured thereby, or any other funds pledged as security for bonds or other evidences of indebtedness; (b) Severance tax and royalty allocations to parishes; (c)  State  and statewide  retirement  system contributions; (d) The Louisiana Education Quality Trust Fund; (e) The Millennium Trust, except appropriations from the trust; and (f) Monies not required to be deposited in the state treasury. Proposed Constitutional Amendment retains present constitution and  further provides that the  Medicaid Trust Fund for the  Elderly is also exempted from such adjustments.",http://legis.la.gov/billdata/streamdocument.asp?did=812574,Yes,"Approves an ammendment which adds Article VII, Section 10(F)(4)(g), retaining present constitution and providing that the Medicaid Trust Fund for the Elderly is also exempted from adjustments to appropriations to eliminate the projected deficit. Current law also exempts the following from such adjustments: (a)  The Bond Security and Redemption Fund or any bonds secured thereby, or any other funds pledged as security for bonds or other evidences of indebtedness; (b) Severance tax and royalty allocations to parishes; (c)  State  and statewide  retirement  system contributions; (d) The Louisiana Education Quality Trust Fund; (e) The Millennium Trust, except appropriations from the trust; and (f) Monies not required to be deposited in the state treasury.",No,"Rejects the proposed addition of Medicaid Trust Fund for the Elderly to Article VII, Section 10(F)(4).",""
BI00075,LA,Amendment No. 2,An amendment to the Constitution of the State of Louisiana to provide that the right to keep and bear arms is a fundamental right and any restriction of that right requires the highest standard of review by a court.,"Act 874 (2012 Regular Session) amends Article I, Section 11.Present Constitution provides that the  right of each citizen to keep and bear arms shall not be abridged and this provision shall not prevent the passage of laws to prohibit carrying a concealed weapon.Proposed Constitutional Amendment provides that the right of each citizen to keep and bear arms is fundamental and shall not be infringed.  Further provides that any restriction on this right shall be subject to strict scrutiny.Proposed Constitutional Amendment deletes the provision relating to the passage of laws to prohibit carrying a concealed weapon",http://legis.la.gov/billdata/streamdocument.asp?did=812575,Yes,"Approves an ammendment to Article I, Section 11 to provides that the right of each citizen to keep and bear arms is fundamental and shall not be infringed.  Further provides that any restriction on this right shall be subject to strict scrutiny. Also deletes the provision relating to the passage of laws to prohibit carrying a concealed weapon.",No,Rejects the proposed amendment and maintains current law which provides that the right of each citizen to keep and bear arms shall not be abridged and this provision shall not prevent the passage of laws to prohibit carrying a concealed weapon.,""
