UID,State,Title,Subtitle,Brief,Text,Response 1,Response 1 Blurb,Response 2,Response 2 Blurb,
BI00001,CA,Proposition 30,"Temporary increases taxes on earnings over $250,000 for seven years and sales taxes by 1/4 cent for four years, to fund schools. Guarantees public safety realignment funding.","Increases taxes on earnings over $250,000 for seven years and sales taxes by 1/4 cent for four years, to fund schools. Guarantees public safety realignment funding.",http://vig.cdn.sos.ca.gov/2012/general/pdf/complete-vig-v2.pdf,Yes,"Increases taxes on earnings over $250,000 for seven years and sales taxes by _ cent for four years, to fund schools. Guarantees public safety realignment funding. Fiscal Impact: Increased state tax revenues through 2018_19, averaging about $6 billion annually over the next few years. Revenues available for funding state budget. In 2012_13, planned spending reductions, primarily to education programs, would not occur.",No,"Does not increase taxes on earnings over $250,000 for seven years and sales taxes by _ cent for four years, to fund schools. Fiscal Impact: In 2012_13, planned spending reductions, primarily to education programs, would occur.",""
BI00002,CA,Proposition 31,"Establishes two-year state budget. Sets rules for offsetting new $200 million annually, with corresponding increases of funding to local governments. Other, potentially more significant changes in state and local budgets, depending on future decisions by public officials. ","Establishes two-year state budget. Sets rules for offsetting new $200 million annually, with corresponding increases of funding to local governments. Other, potentially more significant changes in state and local budgets, depending on future decisions by public officials. ",http://vig.cdn.sos.ca.gov/2012/general/pdf/complete-vig-v2.pdf,Yes,"Establishes two-year state budget. Sets rules for offsetting new $200 million annually, with corresponding increases of funding to local governments. Other, potentially more significant changes in state and local budgets, depending on future decisions by public officials. Establishes two-year state budget cycle. Prohibits Legislature from creating expenditures of more than $25 million unless offsetting revenues or spending cuts are identified. Permits Governor to cut budget unilaterally during declared fiscal emergencies if Legislature failsto act. Requires performance reviews of all state programs. Requires performance goals in state and local budgets. Requires publication of bills at least three days prior to legislative vote. Allows local governments to alter how laws governing state-funded programs apply to them, unless Legislature or state agency vetoes change within 60 days.",No,Does not establish two-year state budget. Maintains current budget process.,""
BI00003,CA,Proposition 32,"Prohibits unions from using payroll-deducted funds for political purposes. Applies same use prohibition to payroll deductions, if any, by corporations or government contractors.","Prohibits unions from using payroll-deducted funds for political purposes. Applies same use prohibition to payroll deductions, if any, by corporations or government contractors.",http://vig.cdn.sos.ca.gov/2012/general/pdf/complete-vig-v2.pdf,Yes,"Prohibits unions from using payroll-deducted funds for political purposes. Applies same use prohibition to payroll deductions, if any, by corporations or government contractors. Prohibits union and corporate contributions to candidates and their committees. Prohibits government contractor contributions to elected officers or their committees. Fiscal Impact: Increased costs to state and local government, potentially exceeding $1 million annually, to implement and enforce the measurees requirements.",No,Allows unions to continue using payroll-deducted funds for political purposes. Applies same by corporations or government contractors.,""
BI00004,CA,Proposition 33,Changes current law to allow insurance companies to set prices based on whether the driver previously carried auto insurance with any insurance company.,Changes current law to allow insurance companies to set prices based on whether the driver previously carried auto insurance with any insurance company.,http://vig.cdn.sos.ca.gov/2012/general/pdf/complete-vig-v2.pdf,Yes,Changes current law to allow insurance companies to set prices based on whether the driver previously carried auto insurance with any insurance company. Allows proportional discount for drivers with some prior coverage. Allows increased cost for drivers without history of continuous coverage. ,No,Maintains current law not allowing insurance companies to set prices based on whether the driver previously carried auto insurance with any insurance company. ,""
BI00005,CA,Proposition 34,Repeals death penalty and replaces it with life imprisonment without possibility of parole. Directs $100 million to law enforcement agencies for investigations of homicide and rape cases.,Repeals death penalty and replaces it with life imprisonment without possibility of parole. Directs $100 million to law enforcement agencies for investigations of homicide and rape cases.,http://vig.cdn.sos.ca.gov/2012/general/pdf/complete-vig-v2.pdf,Yes,"Repeals death penalty and replaces it with life imprisonment without possibility of parole, applying the change retroactively to existing death sentences. Directs $100 million to law enforcement agencies for investigations of homicide and rape cases. Fiscal Impact: Ongoing state and county criminal justice savings of about $130 million annually within a few years, which could vary by tens of millions of dollars. One-time state costs of $100 million for local law enforcement grants.",No,Maintains death penalty.,""
BI00006,CA,Proposition 35,Increases prison sentences and fines for human trafficking convictions. Requires convicted human traffickers to register as sex offenders. Requires registered sex offenders to disclose Internet activities and identities.,Increases prison sentences and fines for human trafficking convictions. Requires convicted human traffickers to register as sex offenders. Requires registered sex offenders to disclose Internet activities and identities.,http://vig.cdn.sos.ca.gov/2012/general/pdf/complete-vig-v2.pdf,Yes,"Increases prison sentences and fines for human trafficking convictions. Requires convicted human traffickers to register as sex offenders. Requires registered sex offenders to disclose Internet activities and identities. Fiscal Impact: Costs of a few million dollars annually to  increased annual fine revenue of a similar amount, dedicated primarily for human trafficking victims.",No,Maintains existing human trafficking and sex offender laws.,""
BI00007,CA,Proposition 36,Revises law to impose life sentence only when new felony conviction is serious or violent. May authorize re-sentencing if third strike conviction was not serious or violent.,Revises law to impose life sentence only when new felony conviction is serious or violent. May authorize re-sentencing if third strike conviction was not serious or violent.,http://vig.cdn.sos.ca.gov/2012/general/pdf/complete-vig-v2.pdf,Yes,"Revises law to impose life sentence only when new felony conviction is serious or violent. May authorize re-sentencing if third strike conviction was not serious or violent. Fiscal Impact: Ongoing state correctional savings of around $70 million annually, with even greater savings (up to $90 million) over the next couple of decades. These savings could vary significantly depending on future state actions.",No,Maintains current three strikes provisions in California law.,""
BI00008,CA,Proposition 37,Requires labeling of food sold to consumers made from plants or animals with genetic material changed in specified ways. ,Requires labeling of food sold to consumers made from plants or animals with genetic material changed in specified ways. ,http://vig.cdn.sos.ca.gov/2012/general/pdf/complete-vig-v2.pdf,Yes,"Requires labeling of food sold to consumers made from plants or animals with genetic material changed in specified ways. Prohibits marketing such food, or other processed food, as ?natural."" Provides exemptions. Fiscal Impact: Increased annual state costs from a few hundred thousand dollars to over $1 million to regulate the labeling of genetically engineered foods. Additional, but likely not significant, governmental costs to address violations under the measure.",No,Maintains existing food labeling regulations.,""
BI00009,CA,Proposition 38,"Increases taxes on earnings using sliding scale, for twelve years. Revenues go to K_12 schools and early childhood programs, and for four years to repaying state debt. ","Increases taxes on earnings using sliding scale, for twelve years. Revenues go to K_12 schools and early childhood programs, and for four years to repaying state debt. ",http://vig.cdn.sos.ca.gov/2012/general/pdf/complete-vig-v2.pdf,Yes,"Increases taxes on earnings using sliding scale, for twelve years. Revenues go to K_12 schools and early childhood programs, and for four years to repaying state debt. Fiscal Impact: Increased state tax revenues for 12 yearsaroughly $10 billion annually in initial years, tending to grow over time. Funds used for schools, child care, and preschool, as well as providing savings on state debt payments.",No,"Maintains current tax, K-12 funding, and state debt levels. ",""
BI00010,CA,Proposition 39,Requires multistate businesses to pay income taxes based on percentage of their sales in California. Dedicates revenues for five years to clean/efficient energy projects.,Requires multistate businesses to pay income taxes based on percentage of their sales in California. Dedicates revenues for five years to clean/efficient energy projects.,http://vig.cdn.sos.ca.gov/2012/general/pdf/complete-vig-v2.pdf,Yes,"Requires multistate businesses to pay income taxes based on percentage of their sales in California. Dedicates revenues for five years to clean/efficient energy projects. Fiscal Impact: Increased state revenues of $1 billion annually, with half of the revenues over the next five years spent on energy efficiency projects. Of the remaining revenues, a significant portion likely would be spent on schools.",No,Maintains current business taxes.,""
BI00011,CA,Proposition 40,"A ?Yes"" vote approves, and a ?No"" vote rejects, new State Senate districts drawn by the Citizens Redistricting Commission. If rejected, districts will be adjusted by officials supervised by the California Supreme Court.","A ?Yes"" vote approves, and a ?No"" vote rejects, new State Senate districts drawn by the Citizens Redistricting Commission. If rejected, districts will be adjusted by officials supervised by the California Supreme Court.",http://vig.cdn.sos.ca.gov/2012/general/pdf/complete-vig-v2.pdf,Yes,Approves new State Senate districts drawn by the Citizens Redistricting Commission. Fiscal Impact: Approving the referendum would have no fiscal impact on the state and local governments.,No,"Rejects new State Senate districts drawn by the Citizens Redistricting Commission. If rejected, districts will be adjusted by officials supervised by the California Supreme Court. Fiscal Impact: Rejecting the referendum would result in a one-time cost of about $1 million to the state and counties.",""
BI00012,WA,Initiative Measure 1185,This measure would restate existing statutory requirements regarding tax and fee increases. ,This measure would restate existing statutory requirements regarding tax and fee increases. ,https://wei.sos.wa.gov/agency/osos/en/press_and_research/PreviousElections/2012/General-Election/Pages/Online-Voters-Guide.aspx,Yes,"Restates existing statutory requirements that legislative actions raising taxes must be approved by two-thirds legislative majorities or receive voter approval, and that new or increased fees require majority legislative approval. ",No,"Does not restate existing statutory requirements that legislative actions raising taxes must be approved by two-thirds legislative majorities or receive voter approval, and that new or increased fees require majority legislative approval. ",""
BI00013,WA,Initiative Measure 1240,Would authorize up to forty publicly-funded charter schools. ,This measure would authorize up to forty publicly-funded charter schools. ,https://wei.sos.wa.gov/agency/osos/en/press_and_research/PreviousElections/2012/General-Election/Pages/Online-Voters-Guide.aspx,Yes,"Authorizes up to forty publicly-funded charter schools open to all students, operated through approved, nonreligious, nonprofit organizations, with government oversight; and modify certain laws applicable to them as public schools. ",No,Does not authorize up to forty publicly-funded charter schools. ,""
BI00014,WA,Referendum Measure 74,"Would allow same-sex couples to marry, preserve domestic partnerships only for seniors, and preserve the right of clergy or religious organizations to refuse to perform, recognize, or accommodate any marriage ceremony.","This bill would allow same-sex couples to marry, preserve domestic partnerships only for seniors, and preserve the right of clergy or religious organizations to refuse to perform, recognize, or accommodate any marriage ceremony.",https://wei.sos.wa.gov/agency/osos/en/press_and_research/PreviousElections/2012/General-Election/Pages/Online-Voters-Guide.aspx,Approved,"The legislature passed Engrossed Substitute Senate Bill 6239 concerning marriage for same-sex couples, modified domestic-partnership law, and religious freedom, and voters have filed a sufficient referendum petition on this bill. This bill would allow same-sex couples to marry, preserve domestic partnerships only for seniors, and preserve the right of clergy or religious organizations to refuse to perform, recognize, or accommodate any marriage ceremony.",Rejected,"Undoes Engrossed Substitute Senate Bill 6239 concerning marriage for same-sex couples, modified domestic-partnership law, and religious freedom. Under the revised law, same-sex couples will not be allowed to marry, but will retain domestic partnerships.",""
BI00015,WA,Initiative to the Legislature 502,"Liscense, regulate, and tax marijuana production, distribution, and possession for persons over twenty-one. ","This measure would license, regulate, and tax marijuana production, distribution, and possession for persons over twenty-one. ",https://wei.sos.wa.gov/agency/osos/en/press_and_research/PreviousElections/2012/General-Election/Pages/Online-Voters-Guide.aspx,Yes,"Licenses and regulate marijuana production, distribution, and possession for persons over twenty-one; remove state-law criminal and civil penalties for activities that it authorizes; tax marijuana sales; and earmark marijuana-related revenues. ",No,Maintain current marijuana laws.,""
BI00016,WA,Engrossed Senate Joint Resolution 8221,"Starting July 1, 2014, phase-down the debt limit percentage in three steps from nine to eight percent and modify the calculation date, calculation period, and the term general state revenues.","This amendment would, starting July 1, 2014, phase-down the debt limit percentage in three steps from nine to eight percent and modify the calculation date, calculation period, and the term general state revenues.",https://wei.sos.wa.gov/agency/osos/en/press_and_research/PreviousElections/2012/General-Election/Pages/Online-Voters-Guide.aspx,Approved,"This amendment would, starting July 1, 2014, phase-down the debt limit percentage in three steps from nine to eight percent and modify the calculation date, calculation period, and the term general state revenues.",Rejected,Maintains the current debt limit.,""
BI00017,WA,Senate Joint Resolution 8223,"Allow public universities to invest specified public funds as authorized by the legislature, including in private companies or stock. ","This amendment would allow public universities to invest specified public funds as authorized by the legislature, including in private companies or stock. ",https://wei.sos.wa.gov/agency/osos/en/press_and_research/PreviousElections/2012/General-Election/Pages/Online-Voters-Guide.aspx,Approved,"This amendment would create an exception to constitutional restrictions on investing public funds by allowing these universities to invest specified public funds as authorized by the legislature, including in private companies or stock.",Rejected,Maintains current constitutional restriction on investing public funds as applied to universities.,""
BI00018,WA,Advisory Vote 1,Supporting the return of a business and occupation tax deduction for certain financial institutionse interest on residential loans.,Supporting the return of a business and occupation tax deduction for certain financial institutionse interest on residential loans.,https://wei.sos.wa.gov/agency/osos/en/press_and_research/PreviousElections/2012/General-Election/Pages/Online-Voters-Guide.aspx,Maintained,"This stance calls for maintaining the legislaturees position, which ended the tax deduction.",Repealed,"The legislature eliminated, without a vote of the people, a business and occupation tax deduction for certain financial institutionse interest on residential loans, costing $170,000,000 in its first ten years, for government spending. This stance calls for the return of the deduction.",""
BI00019,WA,Advisory Vote 2,Supporting the original timeline for expiration of a tax on possession of petroleum products. ,Supporting the original timeline for expiration of a tax on possession of petroleum products. ,https://wei.sos.wa.gov/agency/osos/en/press_and_research/PreviousElections/2012/General-Election/Pages/Online-Voters-Guide.aspx,Maintained,This stance calls for maintaining the legislaturees position of a delayed expiration of tax on possession of petroleum taxes.,Repealed,"The legislature extended, without a vote of the people, expiration of a tax on possession of petroleum products and reduced the tax rate, costing $24,000,000 in its first ten years, for government spending. This stance calls for the repeal of the slower expiration.",""
BI00020,OR,Measure 77 ,"Governor may declare ?catastrophic disaster"" (defined); requires legislative session; authorizes suspending specified constitutional spending restrictions","Amends constitution. Currently, governor has statutory, but not constitutional, authority to declare state of emergency and direct response to emergency. Measure grants Governor constitutional authority to declare and respond to natural or human-caused ?catastrophic disaster"" (defined). Authorizes Governor to redirect previously allocated General Fund and lottery monies to disaster response. Requires legislative session (under emergency conditions, if necessary) to enact implementing legislation; legislation may include temporarily suspending specified constitutional spending restrictions. Terminates Governores disaster spending authority upon enactment of law specifying purposes for which funds may be used. Limits disaster authority of Governor and legislature to 30 days unless legislature acts to shorten/ lengthen period; such legislation may include any provision legislature deems necessary to provide ?orderly transition"" (undefined) to normal conditions. Other provisions.",http://oregonvotes.org/irr/2012/401text.pdf,Yes,"Grants Governor constitutional authority to declare ?catastrophic disaster"" (defined); requires legislative session; legislature may suspend specified constitutional spending restrictions to aid response, recovery.",No,Retains Governor's statutory authority to declare state of emergency; retains constitutional spending restrictions and constitutional restrictions on legislative authority without exception for emergency.,""
BI00021,OR,Measure 78,Changes constitutional language describing governmental system of separation of powers; makes grammatical and spelling changes ,"Amends constitution. Measure makes nonsubstantive changes to wording now contained in the Oregon constitution. Current state constitutional language describes the governmental separation of powers to be divided into three separate ""departments"": Legislative, Executive (including Administrative), and Judicial. Measure revises this constitutional phrasing by changing it to refer to three separate ""branches"" of government, which conforms to more contemporary, commonly-used designations for these separate divisions of government. Measure changes the description of the two houses of the Legislature to the two ""chambers"" of the Legislature (rather than two ""branches"" of the Legislature), which also reflects more modern designations for them. Measure additionally modernizes spelling and makes grammatical changes to replace existing references to the Secretary of State as ""he,"" ""him,"" and ""his"" with gender-neutral wording.",http://oregonvotes.org/irr/2012/402text.pdf,Yes,"Changes constitutional language describing separation of powers to refer to three ?branches"" (instead of three ?departments"" of government; makes other grammatical, spelling changes.",No,"Retains existing constitutional language describing constitutional language describing separation of powers between three ?departments"" of government (rather than three ?branches"" of government); retains misspelled, other language.",""
BI00022,OR,Measure 79,"Prohibits real estate transfer taxes, fees, other assessments, except those operative on December 31, 2009 ","Amends constitution. Current statutory law prohibits a city, county, district, or other political subdivision or municipal corporation from imposing taxes or fees on the transfer of real estate (with certain exceptions). However, the state legislature has the authority, subject to Governor approval, to impose such taxes and fees or to change current statutory law. Measure prohibits the state and any city, county, district, or other political subdivision or municipal corporation from imposing taxes, fees, or other assessments based upon the transfer of any interest in real property or measured by the consideration paid or received upon the transfer of any interest in real property. Measure exempts from the prohibition any taxes, fees, or other assessments in effect and operative on December 31, 2009. Other provisions.",http://oregonvotes.org/irr/2012/005text.pdf,Yes,"Prohibits state/local governments from imposing taxes, fees, assessments on transfer of any interest in real property, except for those operative December 31, 2009.",No,"Retains existing law prohibiting local governments from imposing real estate transfer taxes/fees (with exceptions), allowing state legislature to impose such taxes/fees.",""
BI00023,OR,Measure 80,"Allows personal marijuana, hemp cultivation/use without license; commission to regulate commercial marijuana cultivation/sale","Currently, marijuana cultivation, possession and delivery are prohibited; regulated medical marijuana use permitted. Measure replaces state, local marijuana laws except medical marijuana and driving under the influence laws; distinguishes ?hemp"" from ?marijuana""; prohibits regulation of hemp. Creates commission to license marijuana cultivation by qualified persons and to purchase entire crop. Commission sells marijuana at cost to pharmacies, medical research facilities and to qualified adults for profit through state-licensed stores. Ninety percent of net proceeds goes to state general fund, remainder to drug education, treatment, hemp promotion. Bans sales to, possession by minors. Bans public consumption except where signs permit, minors barred. Commission regulates use, sets prices, other duties; Attorney General to defend against federal challenges/prosecutions. Provides penalties. Effective January 1, 2013; other provisions.",http://oregonvotes.org/irr/2012/009text.pdf,Yes,Allows commercial marijuana (cannabis) cultivation/sale to adults through state-licensed stores; allows unlicensed adult personal cultivation/use; prohibits restrictions on hemp (defined).,No,"Retains existing civil and criminal laws prohibiting cultivation, possession and delivery of marijuana; retains current statutes that permit regulated medical use of marijuana.",""
BI00024,OR,Measure 81,"Prohibits commercial non-tribal fishing with gillnets in Oregon ""inland waters,"" allows use of seine nets","Current law allows Columbia River commercial fishing with gill nets; requires annual adjustment of recreational salmon fishers' percentage share of overall catch; allows issuing of gill net permits within limit of 200; recognizes gill net licenses as valid in Columbia River in both Oregon/Washington. Measure bans non-tribal gill net fishing in Oregon ""inland waters"" (defined); permits use of ""seine nets"" (defined) instead; ensures that recreational salmon fisher's percentage of overall catch remains at 2007-2011 levels; prohibits purchase of salmon caught by gill net by non-tribal fishers in Oregon inland waters; prohibits issuing additional gill net permits; no longer recognizes validity of gill net licenses in Oregon and Washington. Measure may affect Columbia River Compact, tribal fishing rights, and fishing management agreements between federal government, tribes, and states. Other provisions.",http://oregonvotes.org/irr/2012/021text.pdf,Yes,"Changes commercial non-tribal fishing in Oregon ""inland waters"" (defined) by banning gill nets, adopting other regulatory changes; recreational salmon fishers ensured their recent share.",No,"Continues current commercial fishing practices, retains laws allowing gill nets, leaves other current regulations in place; continues annual adjustment of recreational salmon harvest share.",""
