UID,State,Title,Subtitle,Brief,Text,Response 1,Response 1 Blurb,Response 2,Response 2 Blurb,
BI00100,NE,Proposed Amendment No. 2 ,"A Constitutional amendment to establish the right to hunt, to fish, and to harvest wildlife and  to state that public hunting, fishing, and harvesting of wildlife shall be a preferred means of  managing and controlling wildlife.","A vote FOR this constitutional amendment would set forth a constitutional right to hunt, to fish,  and to harvest wildlife and would designate public hunting, fishing, and harvesting of wildlife as a  preferred means of managing and controlling wildlife. The right set forth by this constitutional  amendment would be subject to certain laws, rules, and regulations, and this constitutional amendment  would not be construed to modify current laws relating to trespass or property right laws or  constitutional provisions pertaining to water.    A vote AGAINST this constitutional amendment would result in the right to hunt, to fish, and to  harvest wildlife not being added to the Constitution of Nebraska and public hunting, fishing, and  harvesting of wildlife not being designated a preferred means of managing and controlling wildlife.  ",http://www.sos.ne.gov/elec/2012/pdf/proposed-amendments.pdf,For,"Creates a constitutional right to hunt and fish ""subject to reasonable restrictions.""",Against,Maintains current constitutional language,""
BI00101,NE,Proposed Amendment No. 3 ,A Constitutional amendment to change the limit on legislative terms to three consecutive terms. ,A vote FOR this constitutional amendment would change the number of terms a member of the  Legislature may serve from two consecutive four year terms to three consecutive four year terms.   A vote AGAINST this constitutional amendment would retain two consecutive four year terms as  the number of terms a member of the Legislature may serve. ,http://www.sos.ne.gov/elec/2012/pdf/proposed-amendments.pdf,For,Would allow legislators to serve three terms instead of two.,Against,Maintains current two term limit.,""
BI00102,NE,Proposed Amendment No. 4,A Constitutional amendment to change the salary of members of the Legislature to twentytwo thousand five hundred dollars.  ,"A vote FOR this constitutional amendment would increase the salary for members of the  Legislature from twelve thousand dollars per year to twenty-two thousand five hundred dollars per year,  beginning January 2013.   A vote AGAINST this constitutional amendment would result in no change in the salary for  members of the Legislature.",http://www.sos.ne.gov/elec/2012/pdf/proposed-amendments.pdf,For,"A vote FOR this constitutional amendment would increase the salary for members of the Legislature from twelve thousand dollars per year to twenty-two thousand five hundred dollars per year, beginning January 2013.",Against,A vote AGAINST this constitutional amendment would result in no change in the salary for members of the Legislature.,""
BI00103,NH,Constitutional Amendments 1,A Constitutional ammendment which makes the chief justice the administrative head of all courts in New Hampshire,"Are you in favor of amending article 73-a of the second part of the constitution to read as follows: [Art.] 73-a [Supreme Court, Administration.] The chief justice of the supreme court shall be the administrative head of all the courts.  The chief justice shall, with the concurrence of a majority of the supreme court justices, make rules governing the administration of all courts in the state and the practice and procedure to be followed in all such courts.  The rules so promulgated shall have the force and effect of law.  The legislature shall have a concurrent power to regulate the same matters by statute.  In the event of a conflict between a statute and a court rule, the statute, if not otherwise contrary to this constitution, shall prevail over the rule.",http://sos.nh.gov/2012ElectionInfo.aspx,Yes,"Approves amending article 73-a of the second part of the constitution to read as follows: The chief justice of the supreme court shall be the administrative head of all the courts.  The chief justice shall, with the concurrence of a majority of the supreme court justices, make rules governing the administration of all courts in the state and the practice and procedure to be followed in all such courts.  The rules so promulgated shall have the force and effect of law.  The legislature shall have a concurrent power to regulate the same matters by statute.  In the event of a conflict between a statute and a court rule, the statute, if not otherwise contrary to this constitution, shall prevail over the rule.",No,Maintains current constitutional language,""
BI00104,NH,Constitutional Amendments 2,A Constitutional ammendment which creates a ban on any new income tax in New Hampshire.,"Are you in favor of amending the second part of the constitution by inserting after article 5-b a new article to read as follows: [Art.] 5-c. [Income Tax Prohibited.]  Notwithstanding any general or special provision of this constitution, the general court shall not have the power or authority to impose and levy any assessment, rate, or tax upon income earned by any natural person; however, nothing in this Article shall be construed to prohibit any tax in effect January 1, 2012, or adjustment to the rate of such a tax.",http://sos.nh.gov/2012ElectionInfo.aspx,Yes,"Approves an ammendment which inserts after article 5-b a new article to read as follows: Notwithstanding any general or special provision of this constitution, the general court shall not have the power or authority to impose and levy any assessment, rate, or tax upon income earned by any natural person; however, nothing in this Article shall be construed to prohibit any tax in effect January 1, 2012, or adjustment to the rate of such a tax.",No,Maintains current constitutional language,""
BI00105,NH,"Question from Part II, Article 100",Shall there be a convention to amend or revise the constitution?,Shall there be a convention to amend or revise the constitution?,http://sos.nh.gov/2012ElectionInfo.aspx,Yes,"Would create a constitutional convention to revise, alter, or amend the state constitution.",No,Would not call a constitutional convention.,""
BI00106,NJ,Public Question NO. 1,Approve an amendment to the New Jersey Constitution to allow contributions set by law to be taken from the salaries of Supreme Court Justices and Superior Court Judges for their employee benefits.,"INTERPRETIVE STATEMENT    This amendment clarifies the Legislaturees authority to pass laws requiring contributions be taken from the salaries of Supreme Court Justices and Superior Court Judges for their employee benefits. These benefits include their pension and health care coverage.    The amendment responds to a question raised in a 2011  lawsuit filed by a judge after the Legislature passed and the Governor signed into law P.L.2011, c.78. That law increased the contributions taken from current and future justicese and judgese salaries for their benefits, starting in October 2011. The lawsuit, which was appealed to the New Jersey Supreme Court, argued against taking the higher contributions from currently appointed justices and judges, citing language in the Constitution that their salaries cannot be reduced during their appointed terms.    The amendment clarifies that such contributions, set by law, may be taken from justicese and judgese salaries during their terms. It would also allow for the higher contributions set by P.L.2011, c.78 to be deducted from current and future justices' and judges' salaries.",http://www.njelections.org/2012-results/2012-certification-public-questions.pdf,Yes,"Allows the state of New Jersey to withhold an increased portion of salary from judicial paychecks to cover the costs of pensions and healthcare, responding to a question raised in a 2011  lawsuit filed by a judge after the Legislature passed and the Governor signed into law P.L.2011, c.78. The amendment clarifies that such contributions, set by law, may be taken from justicese and judgese salaries during their terms. It would also allow for the higher contributions set by P.L.2011, c.78 to be deducted from current and future justices' and judges' salaries.",No,Does now allow the state of New Jersey to withhold an increased portion of salary from judicial paychecks to cover the costs of pensions and healthcare,""
BI00107,NJ,Public Question NO. 2,"A bond act to authorize the State to issue bonds in the aggregate principal amount of $750 million to provide matching grants to New Jerseyes colleges and universities. Money from the grants will be used to build, equip and expand higher education facilities for the purpose of increasing academic capacity.",INTERPRETIVE STATEMENTApproval of this act will allow the State to issue bonds in the total principal amount of $750 million. Proceeds from the bonds will be used to provide grants to New Jerseyes public and private colleges and universities to construct and equip higher education buildings to increase academic capacity.Bond proceeds will be allocated as follows:? $300 million for public research universities;? $247.5 million for State colleges and other State universities;? $150 million for county colleges; and? $52.5 million for private institutions with an endowment of $1 billion or less.Public and private colleges and universities which receive grants will be required to provide funds to support 25% of a project.,http://www.njelections.org/2012-results/2012-certification-public-questions.pdf,Yes,Allows the state to borrow $750 million for buildings and upgrades at the state's public universities.,No,Would not authorize borrowing money.,""
BI00108,ND,Constitutional Measure No. 1,"Elimination of the constitutional provision allowing the legislative assembly to levy an annual poll tax of not more than one dollar and fifty cents on every male inhabitant of this state over twenty-one and under fifty years of age, except paupers, idiots, insane persons, and Indians not taxed.","This measure removes the constitutional provision allowing the legislative assembly to levy an annual poll tax of not more than one dollar and fifty cents on every male inhabitant of this state over twenty-one and under fifty years of age, except paupers, idiots, insane persons, and Indians not taxed.",https://vip.sos.nd.gov/pdfs/Portals/scr-4006.pdf,Yes,Amends the constitution to remove language authorizing a poll tax.,No,Maintains current constitutional language,""
BI00109,ND,Constitutional Measure No. 2,Oaths of Office for elected and appointed officials,This amendment provides that members of the executive branch are required to take the oath prescribed by this section.,https://vip.sos.nd.gov/pdfs/Portals/hcr-3009.pdf,Yes,Amends the constitutions to require an oath of office for elected officials in North Dakota.,No,Maintains current constitutional language,""
BI00110,OH,Issue 1 ,Question Presented Pursuant to Article XVI Section 3  of the Constitution of the State of Ohio,"Article XVI, Section 3 of the Constitution of the State of Ohio reads as follows: ?At the general election to be held in the year one thousand nine hundred and thirty-two, and in each twentieth year thereafter, the question: ?Shall there be a convention to revise, alter, or amend the constitution[,]"" shall be submitted to the electors of the state; and in case a majority of the electors, voting for and against the calling of a convention, shall decide in favor of a convention, the General Assembly, at its next session, shall provide, by law, for the election of delegates, and the assembling of such convention, as is provided in the preceding section; but no amendment of this constitution, agreed upon by any convention assembled in pursuance of this article, shall take effect, until the same shall have been submitted to the electors of the state, and adopted by a majority of those voting thereon.?  A majority yes vote is necessary for passage",http://www.sos.state.oh.us/SOS/LegnAndBallotIssues/BallotBoard.aspx#Issues,Yes,"Calls a convention to revise, alter, or amend the Ohio constitution.",No,Maintains the current Ohio constitution,""
BI00111,OH,Issue 2,"Proposed Constitutional Amendment Proposed by Initiative Petition To add and repeal language in Sections 1, 3, 4, 6, 7, 9 and 13 of Article XI, repeal Sections 8 and 14 of Article XI, and add a new Section 16 to Article XI of the Constitution of the State of Ohio ","The proposed amendment would: 1. Remove the authority of elected representatives and grant new authority to appointed officials to establish congressional and state legislative district lines. 2. Create a state funded commission of appointed officials from a limited pool of applicants to replace the aforementioned. The Commission will consist of 12 members as follows: four affiliated with the largest political party, four affiliated with the second largest political party and four not affiliated with either of the two largest political parties. Affirmative votes of 7 of 12 members are needed to select a plan.  3. Require new legislative and congressional districts be immediately established by the Commission to replace the most recent districts adopted by elected representatives, which districts shall not be challenged except by court order until the next federal decennial census and apportionment. In the event the Commission is not able to determine a plan by October 1, the Ohio Supreme Court would need to adopt a plan from all the plans submitted to the Commission. 4. Change the standards and requirements in the Constitution for drawing legislative and congressional districts. 5. Mandate the General Assembly to appropriate all funds as determined by the Commission including, but not be limited to, compensating: 1. Staff  2. Consultants 3. Legal counsel  4. Commission members  If approved, the amendment will be effective thirty days after the election. A majority yes vote is necessary for the amendment to pass. SHALL THE AMENDMENT BE APPROVED? ",http://www.sos.state.oh.us/SOS/LegnAndBallotIssues/BallotBoard.aspx#Issues,Yes,Creates an independent redistricting commission.,No,Maintains current redistricting process.,""
BI00112,OK,State Question No. 758,"Ad Valorem Taxation Limitation on Valuation Increases, changing the limits on increases in fair cash value.","This measure amends the State Constitution. It amends Section 8B of Article 10.  The measure deals with real property taxes also called ad valorem taxes. These taxes are based on several factors. One factor is the fair cash value of the property.   The measure changes the limits on increases in fair cash value. Now, increases are limited to 5% of fair cash value in any taxable year.  The measure changes the cap on increases to 3% for some property. The 3% cap would apply to homestead exempted property. The cap would also apply to agricultural land.  The measure also removes obsolete language.  SHALL THE PROPOSAL BE APPROVED?",https://www.sos.ok.gov/documents/questions/758.pdf,Yes,Limits increases in property taxes to 3% and also apply to agricultural land.  The measure also removes obsolete language.,No,Maintains current property tax increase limit of 5%.,""
BI00113,OK,State Question No. 759,"Prohibits certain preferential treatment or discrimination in the areas of employment, education and contracting. In these areas, the measure does not allow affirmative action programs.","This measure adds a new section to the State Constitution. It adds Section 36 to Article II.  The measure deals with three areas of government action. These areas are employment, education and contracting.   In these areas, the measure does not allow affirmative action programs. Affirmative action programs give preferred treatment based on race, color or gender. They also give preferred treatment based on ethnicity or national origin. Discrimination on these bases is also not permitted.   The measure permits affirmative action in three instances. 1. When gender is a bonafide qualification, it is allowed. 2. Existing court orders and consent decrees that require preferred treatment will continue and can be followed. 3. Affirmative action is allowed when needed to keep or obtain federal funds.  The measure applies to the State and its agencies. It applies to counties, cities and towns. It applies to school districts. It applies to other State subdivisions.  The measure applies only to actions taken after its approval by the people.  SHALL THE PROPOSAL BE APPROVED?",https://www.sos.ok.gov/documents/questions/759.pdf,Yes,"Prohibits affirmative action by government in most instances.  The measure permits affirmative action in three instances. 1. When gender is a bonafide qualification, it is allowed. 2. Existing court orders and consent decrees that require preferred treatment will continue and can be followed. 3. Affirmative action is allowed when needed to keep or obtain federal funds.  The measure applies to the State and its agencies. It applies to counties, cities and towns. It applies to school districts. It applies to other State subdivisions.",No,Maintains current constitutional language,""
BI00114,OK,State Question No. 762,Modifies the power and authority of the Governor and Pardon and Parole Board in the parole process for nonviolent offenders,"This measure amends Section 10 of Article 6 of the Oklahoma Constitution. It changes current law, decreasing the power and authority of the Governor by removing the Governor from the parole process for persons convicted of certain offenses defined as nonviolent offenses. It enlarges the power and authority of the Pardon and Parole Board by authorizing that Board, in place of the Governor, to grant parole to persons convicted of certain offenses defined as nonviolent offenses.  The Legislature defines what offenses are nonviolent offenses and the Legislature may change that definition.  The measure authorizes the Pardon and Parole Board to recommend to the Governor, but not to itself grant, parole for persons convicted of certain offenses, specifically those offenses identified by law as crimes for which persons are required to serve not less than eighty-five percent of their sentence prior to being considered for parole and those designated by the Legislature as exceptions to nonviolent offenses. For those offenses for which persons are required to serve a minimum mandatory period of confinement prior to being eligible to be considered for parole, the Pardon and Parole Board may not recommend parole until that period of confinement has been served.  SHALL THE PROPOSAL BE APPROVED?",https://www.sos.ok.gov/documents/questions/762.pdf,Yes,Removes the Governor from the parole process for nonviolent offenses.,No,Maintains current constitutional language,""
BI00115,OK,State Question No. 764,Creates the Water Infrastructure Credit Enhancement Reserve Fund and allows the Oklahoma Water Resources Board to issue bonds ,This measure amends the Oklahoma Constitution. It adds a new Section 39A to Article 10. It would allow the Oklahoma Water Resources Board to issue bonds. Any bonds issued would be used to provide a reserve fund for the Board. The fund would be a reserve fund for certain water resource and sewage treatment funding programs. The fund could only be used to pay other bonds and obligations for the funding programs. The bonds could only be issued after other monies and sources are used for repayment. The bonds would be general obligation bonds. Not more than Three Hundred Million Dollars worth of bonds could be issued. The Legislature would provide the monies to pay for the bonds. The Legislature would provide for methods for issuing the bonds. The Legislature would provide for how the fund is administered.   SHALL THE PROPOSAL BE APPROVED?,https://www.sos.ok.gov/documents/questions/764.pdf,Yes,Allows the Oklahoma Water Resources board to issue up to $300 million in bonds.,No,Maintains current constitutional language,""
BI00116,OK,State Question No. 765,"Repeals sections of the Constitution relating to the Department of Public Welfare, its commission and director; grants the Legislature the authority to create and direct the administration of a department to provide for public welfare","The measure amends the Oklahoma Constitution. It abolishes the Oklahoma Department of Human Services, the Oklahoma Commission of Human Services and the position of Director of the Oklahoma Department of Human Services. These entities were created under different names by Sections 2, 3 and 4 of Article 25 of the Oklahoma Constitution and given duties and responsibilities related to the care of the aged and needy. The measure repeals these sections of the Constitution and consequently, removes the power of the Commission of Human Services to establish policy and adopt rules and regulations. Under the measure, the Legislature and the people by initiative petition retain the power to adopt legislation for these purposes.   The measure adds a provision to the Constitution authorizing the Legislature to create a department or departments to administer and carry out laws to provide for the care of the aged and the needy. The measure also authorizes the Legislature to enact laws requiring the newly-created department or departments to perform other duties.   SHALL THE PROPOSAL BE APPROVED?",https://www.sos.ok.gov/documents/questions/765.pdf,Yes,Abolishes the Oklahoma Department of Human Services and authorizes the legislature to create a department or departments to provide for the care of the aged and the needy.,No,Maintains current constitutional language,""
BI00117,OK,State Question No. 766,"Exempts all intangible personal property from ad valorem taxation. If adopted, the measure would apply to property taxation starting with the tax year that begins on January 1, 2013","This measure amends Section 6A of Article 10 of the Oklahoma Constitution. At present that section exempts some intangible personal property from ad valorem property taxation. This measure would exempt all intangible personal property from ad valorem property taxation.   An ad valorem property tax is a tax imposed upon the value of property.   Intangible Personal Property is property whose value is not derived from its physical attributes, but rather from what it represents or evidences.   Intangible Personal Property which is still currently taxed but would not be taxed if the measure is adopted, includes items such as:   -patents, inventions, formulas, designs, and trade secrets;  -licenses, franchise, and contracts;  -land leases, mineral interests, and insurance policies;  -custom computer software; and  -trademarks, trade names and brand names.   If adopted, the measure would apply to property taxation starting with the tax year that begins on January 1, 2013:   SHALL THE PROPOSAL BE APPROVED?",https://www.sos.ok.gov/documents/questions/766.pdf,Yes,"Exempts intangible property, such as intellectual property, leases, mining interests, and contracts from property taxes.",No,Maintains current constitutional language,""
BI00118,RI,Question 1,Approval of an Act Authorizing State-Operated Casino Gaming at Twin River in the Town of Lincoln,"Shall an act be approved which would authorize the facility known as ?Twin River? in the town of Lincoln to add state-operated casino gaming, such as table games, to the types of gambling it offers?",http://sos.ri.gov/documents/elections/VoterHandbook_2012.pdf,Approve,A vote to Approve this question means you wish to approve the act authorizing Twin River to engage in state-operated casino gaming at its facility in the Town of Lincoln in accordance with the provisions of such act.,Reject,A vote to Reject this question means you do not approve the act authorizing Twin River to engage in stateoperated casino gaming at its facility in the Town of Lincoln in accordance with the provisions of such act.,""
BI00119,RI,Question 2,Approval of an Act authorizing State-Operated Casino Gaming at Newport Grand in the City of Newport,"Shall an act be approved which would authorize the facility known as ?Newport Grand? in the city of Newport to add state-operated casino gaming, such as table games, to the types of gambling it offers?",http://sos.ri.gov/documents/elections/VoterHandbook_2012.pdf,Approve,A vote to Approve this question means you wish to approve the act authorizing Newport Grand to engage in state-operated casino gaming at its facility in the City of Newport in accordance with the provisions of such act.,Reject,A vote to Reject this question means you do not approve the act authorizing Newport Grand to engage in stateoperated casino gaming at its facility in the City of Newport in accordance with the provisions of such act.,""
BI00120,RI,Question 3,"State of Rhode Island to issue general obligation bonds, refunding bonds, and temporary notes in an amount not to exceed fifty million dollars ($50,000,000) for renovations and modernization of academic buildings at Rhode Island College including renovation, upgrade and expansion of health and nursing facilities on the campus of Rhode Island College.","Approval of this question will allow the State of Rhode Island to issue general obligation bonds, refunding bonds, and temporary notes in an amount not to exceed fifty million dollars ($50,000,000) for renovations and modernization of academic buildings at Rhode Island College including renovation, upgrade and expansion of health and nursing facilities on the campus of Rhode Island College.",http://sos.ri.gov/documents/elections/VoterHandbook_2012.pdf,Approve,Approves issuing of said bonds.,Reject,Does not allow for issuing of said bonds.,""
